{
  "$schema": "https://json-schema.org/draft/2020-12/schema",
  "$id": "https://raw.githubusercontent.com/Nicogo1705/AssetContainer/main/schemas/registry-entry.schema.json",
  "title": "Stride Asset Store - Registry Entry",
  "description": "A registry entry. Lives at AssetContainer/registry/<id>.json. This is what a PR adds.",
  "type": "object",
  "additionalProperties": false,
  "required": ["id", "repo", "latest"],
  "properties": {
    "id": {
      "type": "string",
      "pattern": "^[a-z0-9]+(\\.[a-z0-9-]+)+$",
      "description": "Must match the file name (<id>.json) and AssetData/manifest.json#id."
    },
    "repo": {
      "type": "string",
      "format": "uri",
      "description": "URL of the public git repository hosting AssetData/."
    },
    "latest": {
      "type": "object",
      "description": "The 'open' version: points at a branch or tag. The index resolves it to an immutable commit.",
      "additionalProperties": false,
      "required": ["ref"],
      "properties": {
        "ref": { "type": "string", "description": "Tracked branch or tag, e.g. main or v1.2.0." },
        "commit": { "type": "string", "pattern": "^[0-9a-f]{40}$", "description": "Optional commit pin. Informative: the resolved SHA lives in index.lock.json, and nothing writes it back here." }
      }
    },
    "deprecated": {
      "type": "object",
      "description": "Marks the asset as deprecated. It stays installable but the storefront warns and stops promoting it.",
      "additionalProperties": false,
      "properties": {
        "reason": { "type": "string", "maxLength": 280 },
        "successor": { "type": "string", "pattern": "^[a-z0-9]+(\\.[a-z0-9-]+)+$", "description": "Store id of the asset to use instead." }
      }
    },
    "certified": {
      "type": "array",
      "description": "Versions stamped as quality-approved by the registry maintainers. Editable only by CODEOWNERS.",
      "items": {
        "type": "object",
        "additionalProperties": false,
        "required": ["version", "commit"],
        "properties": {
          "version": { "type": "string" },
          "tag": { "type": "string", "description": "Human-readable alias of the certified commit." },
          "commit": { "type": "string", "pattern": "^[0-9a-f]{40}$", "description": "Certified commit (immutable source of truth)." },
          "certifiedBy": { "type": "string" },
          "certifiedAt": { "type": "string", "format": "date" }
        }
      }
    }
  }
}
