{
  "id": "com.nicogo.number-textures",
  "repo": "https://github.com/Nicogo1705/StrideNumberTextures",
  "latest": {
    "ref": "main"
  },
  "certified": [
    {
      "version": "1.0.0",
      "tag": "v1.0.0",
      "commit": "37030431df1cd1c2bcfec90140b3a37896e9438d",
      "certifiedBy": "Nicogo1705",
      "certifiedAt": "2026-07-04"
    },
    {
      "version": "1.1.0",
      "tag": "v1.1.0",
      "commit": "f56f2556fa54393cc94f5bfbd5c052aff6066f8a",
      "certifiedBy": "Nicogo1705",
      "certifiedAt": "2026-08-21"
    },
    {
      "version": "1.2.0",
      "tag": "v1.2.0",
      "commit": "14706cf31fba0efa5ef7fbc5fdbad26c3888dbba",
      "certifiedBy": "Nicogo1705",
      "certifiedAt": "2026-08-21"
    }
  ]
}
