{
  "id": "com.nicogo.placeholder-textures",
  "repo": "https://github.com/Nicogo1705/StridePlaceholderTextures",
  "latest": {
    "ref": "main"
  },
  "certified": [
    {
      "version": "1.0.0",
      "tag": "v1.0.0",
      "commit": "3effec741f5026a3ae92c2cc46c584d8847d91d4",
      "certifiedBy": "Nicogo1705",
      "certifiedAt": "2026-07-04"
    },
    {
      "version": "1.1.0",
      "tag": "v1.1.0",
      "commit": "afe95582a22ce4195682d336088236df256e8f88",
      "certifiedBy": "Nicogo1705",
      "certifiedAt": "2026-08-21"
    }
  ]
}
