{
  "id": "com.nicogo.marching-cube-compute-shader",
  "repo": "https://github.com/Nicogo1705/StrideMarchingCubeSystem",
  "latest": {
    "ref": "master"
  },
  "certified": [
    {
      "version": "1.0.0",
      "tag": "v1.0.0",
      "commit": "b337011f3a5944bae2eb12c7b93aa88066b63202",
      "certifiedBy": "Nicogo1705",
      "certifiedAt": "2026-07-04"
    },
    {
      "version": "1.1.0",
      "tag": "v1.1.0",
      "commit": "602f5abe84dfaeed9c73b9990027e66919a1906f",
      "certifiedBy": "Nicogo1705",
      "certifiedAt": "2026-08-21"
    }
  ]
}
