{
  "id": "com.nicogo.dependency-injection",
  "repo": "https://github.com/Nicogo1705/StrideDependencyInjectionSystem",
  "latest": {
    "ref": "master"
  },
  "certified": [
    {
      "version": "1.0.0",
      "tag": "v1.0.0",
      "commit": "ed7a0c9a976846be0419d72cf3e8f4c9c6726f68",
      "certifiedBy": "Nicogo1705",
      "certifiedAt": "2026-07-04"
    },
    {
      "version": "1.1.0",
      "tag": "v1.1.0",
      "commit": "a0d13d9cb76525970ad79d9c53d6ce5e99d2f03a",
      "certifiedBy": "Nicogo1705",
      "certifiedAt": "2026-08-21"
    }
  ]
}
